[
  {
    "id": "dji-avata-2",
    "name": "DJI Avata 2",
    "vendor": "DJI",
    "version": 1,
    "verified": false,
    "massKg": 0.377,
    "cruiseAirspeedMps": 12.0,
    "cruisePowerW": 105.3,
    "climb": {
      "method": "potential-energy",
      "efficiency": 0.3
    },
    "notes": "cruisePowerW = battery energy / time to fly the max flight distance (13.0 km at 43.2 kph) = 31.7 Wh / 18.1 min = 105.3 W at 12.0 m/s. DJI flew from 100% to a forced landing in still air at sea level, so this is an average over the whole pack. The same manual gives 23 min at 21.6 kph, which is 82.7 W at 6 m/s. Climb efficiency 0.3 is a conservative planning value, not a vendor figure; replace it with a measurement.",
    "source": {
      "kind": "derived",
      "reference": "DJI Avata 2 User Manual v1.0, Specifications: Takeoff Weight approx. 377 g; Max Flight Distance 13.0 km (flying forward at 43.2 kph, windless, sea level, 100% to 0%); Intelligent Flight Battery Energy 31.7 Wh",
      "url": "https://dl.djicdn.com/downloads/DJI_Avata_2/UM/20250108/DJI_Avata_2_User_Manual_v1.0_en.pdf",
      "retrieved": "2026-10-20"
    }
  },
  {
    "id": "dji-fpv",
    "name": "DJI FPV",
    "vendor": "DJI",
    "version": 1,
    "verified": false,
    "massKg": 0.795,
    "cruiseAirspeedMps": 11.1,
    "cruisePowerW": 133.2,
    "climb": {
      "method": "potential-energy",
      "efficiency": 0.3
    },
    "notes": "cruisePowerW = battery energy / max flight time (20 min at 40 kph) = 44.4 Wh / 20.0 min = 133.2 W at 11.1 m/s. DJI flew from 100% to a forced landing in still air at sea level, so this is an average over the whole pack. 40 kph is 11.1 m/s. Climb efficiency 0.3 is a conservative planning value, not a vendor figure; replace it with a measurement.",
    "source": {
      "kind": "derived",
      "reference": "DJI FPV User Manual v1.2, Specifications: Takeoff Weight approx. 795 g; Max Flight Time approx. 20 mins (measured while flying at 40 kph in windless conditions); Intelligent Flight Battery Energy 44.4 Wh",
      "url": "https://dl.djicdn.com/downloads/DJI_FPV/20210615UM/DJI_FPV_User_Manual_v1.2_EN.pdf",
      "retrieved": "2026-10-20"
    }
  },
  {
    "id": "dji-neo",
    "name": "DJI Neo",
    "vendor": "DJI",
    "version": 1,
    "verified": false,
    "massKg": 0.135,
    "cruiseAirspeedMps": 8.0,
    "cruisePowerW": 43.2,
    "climb": {
      "method": "potential-energy",
      "efficiency": 0.3
    },
    "notes": "cruisePowerW = battery energy / time to fly the max flight distance (7 km at 8 m/s) = 10.5 Wh / 14.6 min = 43.2 W at 8.0 m/s. DJI flew from 100% to a forced landing in still air at sea level, so this is an average over the whole pack. The same page gives 18 min at 2 m/s, which is 35.0 W. Mass is without propeller guards. Climb efficiency 0.3 is a conservative planning value, not a vendor figure; replace it with a measurement.",
    "source": {
      "kind": "derived",
      "reference": "DJI Neo specs: Takeoff Weight approx. 135 g; Max Flight Distance 7 km (flying forward at 8 m/s, windless, sea level, until forced landing); Battery Energy 10.5 Wh",
      "url": "https://www.dji.com/neo/specs",
      "retrieved": "2026-10-20"
    }
  }
]
